{
  "schema_version": "1.0",
  "kind": "session",
  "session_id": "S001",
  "source": "sessions/S001/source.mp4",
  "language": "es-CO",
  "duration_ms": 42000,
  "modality": ["audio", "video"],
  "speakers": [
    { "id": "S1", "name": "Moderator", "type": "moderator" },
    { "id": "S2", "name": "P01", "type": "participant" }
  ],
  "utterances": [
    {
      "id": "U-0001",
      "speaker_id": "S1",
      "turn": 1,
      "start_ms": 1000,
      "end_ms": 4000,
      "text": "¿Qué haces cuando entra una alerta automática?"
    },
    {
      "id": "U-0002",
      "speaker_id": "S2",
      "turn": 2,
      "start_ms": 8000,
      "end_ms": 13000,
      "text": "No sé si confiar; prefiero verificar manualmente antes de actuar.",
      "prosody": { "volume": "low", "pace": "slow", "hesitations": 1 },
      "annotation": "Voice drops on 'confiar'."
    },
    {
      "id": "U-0003",
      "speaker_id": "S2",
      "turn": 3,
      "start_ms": 18000,
      "end_ms": 22000,
      "text": "Si pudiera anular la alerta a mano, la usaría más."
    }
  ],
  "silences": [
    {
      "id": "SIL-001",
      "start_ms": 4000,
      "end_ms": 8000,
      "duration_ms": 4000,
      "context": "after_question"
    }
  ],
  "cues": [
    {
      "id": "CUE-001",
      "kind": "sigh",
      "start_ms": 7000,
      "end_ms": 7600,
      "source": "audio",
      "speaker_id": "S2",
      "confidence": 0.82
    }
  ],
  "frames": [
    {
      "id": "FR-000005000",
      "at_ms": 5000,
      "path": "sessions/S001/frames/000005000.jpg",
      "trigger": "silence_after_question",
      "linked_utterance_id": "U-0001"
    }
  ],
  "provenance": {
    "transcriber": "compost-transcriber@0.3.1",
    "asr_model": "whisper-large-v3-event-tags"
  }
}
